{
  "$schema": "http://json-schema.org/draft-07/schema#",
  "title": "Pitch Black Palette",
  "type": "object",
  "additionalProperties": false,
  "minProperties": 71,
  "definitions": {
    "hexColor": {
      "$ref": "./definitions.schema.json#/definitions/hexColor"
    },
    "hexOpacity": {
      "$ref": "./definitions.schema.json#/definitions/hexOpacity"
    }
  },
  "properties": {
    "$schema": {
      "type": "string",
      "description": "URI or path to the JSON schema file"
    },
    "background_primary": { "$ref": "#/definitions/hexColor" },
    "background_transparent": { "$ref": "#/definitions/hexColor" },
    "background_drop": { "$ref": "#/definitions/hexColor" },
    "background_selection": { "$ref": "#/definitions/hexColor" },
    "background_selection_highlight": { "$ref": "#/definitions/hexColor" },
    "background_selection_match": { "$ref": "#/definitions/hexColor" },
    "background_selection_player_opacity": {
      "$ref": "#/definitions/hexOpacity"
    },
    "background_surface": { "$ref": "#/definitions/hexColor" },
    "background_surface_active": { "$ref": "#/definitions/hexColor" },
    "background_surface_hover": { "$ref": "#/definitions/hexColor" },
    "foreground_as_background_opacity": { "$ref": "#/definitions/hexOpacity" },
    "foreground_primary": { "$ref": "#/definitions/hexColor" },
    "foreground_secondary": { "$ref": "#/definitions/hexColor" },
    "foreground_dim": { "$ref": "#/definitions/hexColor" },
    "foreground_disabled": { "$ref": "#/definitions/hexColor" },
    "border_dim": { "$ref": "#/definitions/hexColor" },
    "border_focus": { "$ref": "#/definitions/hexColor" },
    "state_error": { "$ref": "#/definitions/hexColor" },
    "state_warning": { "$ref": "#/definitions/hexColor" },
    "state_info": { "$ref": "#/definitions/hexColor" },
    "state_success": { "$ref": "#/definitions/hexColor" },
    "state_remote": { "$ref": "#/definitions/hexColor" },
    "state_debug": { "$ref": "#/definitions/hexColor" },
    "git_added": { "$ref": "#/definitions/hexColor" },
    "git_conflict": { "$ref": "#/definitions/hexColor" },
    "git_deleted": { "$ref": "#/definitions/hexColor" },
    "git_modified": { "$ref": "#/definitions/hexColor" },
    "git_ignored": { "$ref": "#/definitions/hexColor" },
    "git_renamed": { "$ref": "#/definitions/hexColor" },
    "git_submodule": { "$ref": "#/definitions/hexColor" },
    "git_untracked": { "$ref": "#/definitions/hexColor" },
    "git_word_added": { "$ref": "#/definitions/hexColor" },
    "git_word_deleted": { "$ref": "#/definitions/hexColor" },
    "syntax_attribute": { "$ref": "#/definitions/hexColor" },
    "syntax_character": { "$ref": "#/definitions/hexColor" },
    "syntax_comment": { "$ref": "#/definitions/hexColor" },
    "syntax_comment_documentation": { "$ref": "#/definitions/hexColor" },
    "syntax_constant": { "$ref": "#/definitions/hexColor" },
    "syntax_control": { "$ref": "#/definitions/hexColor" },
    "syntax_css": { "$ref": "#/definitions/hexColor" },
    "syntax_enum_member": { "$ref": "#/definitions/hexColor" },
    "syntax_function": { "$ref": "#/definitions/hexColor" },
    "syntax_json_key": { "$ref": "#/definitions/hexColor" },
    "syntax_keyword": { "$ref": "#/definitions/hexColor" },
    "syntax_method": { "$ref": "#/definitions/hexColor" },
    "syntax_numeric": { "$ref": "#/definitions/hexColor" },
    "syntax_operator": { "$ref": "#/definitions/hexColor" },
    "syntax_operator_special": { "$ref": "#/definitions/hexColor" },
    "syntax_regex": { "$ref": "#/definitions/hexColor" },
    "syntax_regex_character": { "$ref": "#/definitions/hexColor" },
    "syntax_regex_operator": { "$ref": "#/definitions/hexColor" },
    "syntax_regex_punctuation": { "$ref": "#/definitions/hexColor" },
    "syntax_static": { "$ref": "#/definitions/hexColor" },
    "syntax_string": { "$ref": "#/definitions/hexColor" },
    "syntax_type": { "$ref": "#/definitions/hexColor" },
    "syntax_variable": { "$ref": "#/definitions/hexColor" },
    "syntax_variable_constant": { "$ref": "#/definitions/hexColor" },
    "ansi_black": { "$ref": "#/definitions/hexColor" },
    "ansi_red": { "$ref": "#/definitions/hexColor" },
    "ansi_green": { "$ref": "#/definitions/hexColor" },
    "ansi_yellow": { "$ref": "#/definitions/hexColor" },
    "ansi_blue": { "$ref": "#/definitions/hexColor" },
    "ansi_magenta": { "$ref": "#/definitions/hexColor" },
    "ansi_cyan": { "$ref": "#/definitions/hexColor" },
    "ansi_white": { "$ref": "#/definitions/hexColor" },
    "ansi_bright_black": { "$ref": "#/definitions/hexColor" },
    "ansi_bright_red": { "$ref": "#/definitions/hexColor" },
    "ansi_bright_green": { "$ref": "#/definitions/hexColor" },
    "ansi_bright_yellow": { "$ref": "#/definitions/hexColor" },
    "ansi_bright_blue": { "$ref": "#/definitions/hexColor" },
    "ansi_bright_magenta": { "$ref": "#/definitions/hexColor" },
    "ansi_bright_cyan": { "$ref": "#/definitions/hexColor" },
    "ansi_bright_white": { "$ref": "#/definitions/hexColor" }
  }
}
